Tweeter,Tweet ID,Tweet Time,Tweet Text,Topics
Mike_Pence,1331994899495985155,2020-11-26 16:15:05,"On this Thanksgiving Day, we’re thankful for our Family, Friends &amp; the Doctors, Nurses, First Responders &amp; Men &amp; Women of our Armed Forces that we’ve met along the way. God Bless our Healthcare Workers &amp; our Military, especially those deployed overseas Defending Our Freedom! 🦃🇺🇸 https://t.co/LpjZGqbRHc",
Mike_Pence,1331946293321719812,2020-11-26 13:01:57,Happy Thanksgiving from @SecondLady and our Family to yours! https://t.co/3T1lI4fRpA,
Mike_Pence,1331713656183255041,2020-11-25 21:37:32,"With Thanksgiving around the corner, it’s important to remember those less fortunate. Let’s all do our part to make sure every American has a Happy Thanksgiving by supporting your Local Food Bank!

Find a way to support the families in your community: https://t.co/jvC0Kr40B0",
Mike_Pence,1331336672609492996,2020-11-24 20:39:32,"All across this great Nation, hardworking Americans are seeing their 401k’s up and more of their hard-earned money in their pockets! American workers are WINNING under President @realDonaldTrump!",
Mike_Pence,1331309547630235655,2020-11-24 18:51:45,"In four short years, President @realDonaldTrump revived our economy, cut taxes, rolled back regulation, fought for free and fair trade, unleashed American energy, and created more than 7 MILLION good paying jobs! And today the Dow Jones hit 30,000 for the first time EVER!",
Mike_Pence,1331285182226313222,2020-11-24 17:14:56,"For the first time ever, Dow Jones Industrial Average hits 30,000! America is coming BACK under President @realDonaldTrump! 🇺🇸 https://t.co/y4c9haoXNi",
Mike_Pence,1331002396252770304,2020-11-23 22:31:14,"Defend the Senate Majority!
Support ⁦@Perduesenate⁩ &amp; ⁦@KLoeffler⁩ Today! #MAGA #GASEN 🇺🇸 https://t.co/sq5wt2ldlm",
Mike_Pence,1330917625552134148,2020-11-23 16:54:23,https://t.co/hmc9aFsaje,
Mike_Pence,1330917260895072256,2020-11-23 16:52:56,https://t.co/SK5FSduYLU,
Mike_Pence,1329930752209920001,2020-11-20 23:32:54,"Where @Perduesenate and @KLoeffler cut taxes and are defending the right to keep more of what you earn, Jon Ossoff and Raphael Warnock want to RAISE taxes on working families and small businesses! We cannot let that happen, we must Defend the Republican Majority! https://t.co/SRNOSZy8vW",
Mike_Pence,1329929987168886786,2020-11-20 23:29:52,"Thank you, Gainesville! For who they are, for all that we’ve accomplished, we need @Perduesenate and @KLoeffler back in a Republican Majority in the United States Senate! We need Georgia to DEFEND THE MAJORITY on January 5, 2021! 🇺🇸 https://t.co/uwdt0VLsRX",
Mike_Pence,1329914848680022017,2020-11-20 22:29:43,"We have accomplished Great things under the leadership of President @realDonaldTrump and with the support of @KLoeffler &amp; @Perduesenate! We rebuilt our military, revived our economy, secured our border, stood with law enforcement, and fought for life, liberty, &amp; the Constitution! https://t.co/4agZBvuzRe",
Mike_Pence,1329903684554280960,2020-11-20 21:45:21,"With President @realDonaldTrump, @KLoeffler and @Perduesenate, we will always stand with the amazing men and women of Law Enforcement and we will always BACK THE BLUE! https://t.co/M6ACvGZjjF",
Mike_Pence,1329877491822030849,2020-11-20 20:01:16,"With the unwavering support of Georgia’s two Senators, we’ve seen more than 200 Conservative Judges appointed to our courts at every level and they are all men and women who will uphold all the God-given liberties enshrined in our Constitution! https://t.co/0pFqL70mHX",
BernieSanders,1349498629342580740,2021-01-13 23:28:40,"The House of Representatives has done its job and impeached Donald Trump on a bipartisan basis.

The Senate must now carry out its constitutional duty and convict Trump to ensure that neither he, nor any other president, can subvert our democracy again.",
BernieSanders,1349432258067881985,2021-01-13 19:04:56,"In this unprecedented moment, the new Democratic majority must show that we can walk and chew bubble gum at the same time. Yes. We must impeach Trump. Yes. We must process Biden's nominees. Yes. We must pass legislation that addresses the enormous crises facing working families.",
BernieSanders,1349199909581430786,2021-01-13 03:41:40,"Let's make it permanent by ending Citizens United, abolishing super PACs, getting big money out of politics, and moving to the public funding of elections. https://t.co/XNYVzD1xxw",
BernieSanders,1348799652381020164,2021-01-12 01:11:11,"Let's be clear. If Trump is too dangerous to send out a tweet or a Facebook post, he's too dangerous to be commander-in-chief. Donald Trump must be removed from office immediately and held accountable for his horrific acts of sedition, violence and chaos.",
BernieSanders,1348633731720949761,2021-01-11 14:11:52,"President-elect Biden is absolutely right. $600 is not enough for working class Americans who are struggling to pay the rent and feed their families. Our first order of business must be to pass $2,000 direct payments and major COVID-relief. https://t.co/DS2MUYSxTT",
BernieSanders,1348368903425155073,2021-01-10 20:39:32,"Republicans didn’t care about the deficit when it came to tax breaks for billionaires. 

We cannot buy into their rhetoric about the deficit now. 

This is a moment to invest in the American people and create millions of jobs rebuilding the economy. https://t.co/ZHqYoPCWFr",
BernieSanders,1348046272192782339,2021-01-09 23:17:31,"All over America, millions of people are worried they will not be able to pay the rent, put food on the table, purchase their prescription drugs or go to a doctor when they get sick. We must respond to their pain with a bold economic agenda not seen in this country since FDR. https://t.co/NCIyHkQHo1",
BernieSanders,1347711824179949568,2021-01-09 01:08:32,Jane and I send our deepest condolences to the family of Officer Brian Sicknick who died from injuries sustained protecting the Capitol. Our country has paid a heavy price for the riots that took place and the rhetoric that inspired them. This must never happen again.,
BernieSanders,1347625769242140675,2021-01-08 19:26:35,"Some people ask: Why would you impeach and convict a president who has only a few days left in office? The answer: Precedent. It must be made clear that no president, now or in the future, can lead an insurrection against the U.S. government.",
BernieSanders,1347370019081117701,2021-01-08 02:30:20,"Now that Democrats have power, we have to be bold in a way we have not seen since FDR in the 1930s. 

The first order of business: A new COVID relief bill with $2,000 payments for every working class adult. https://t.co/1jHtqg33nN",
BernieSanders,1347269213694676992,2021-01-07 19:49:46,A number of Administration officials are resigning in protest to Trump’s horrific acts of sedition yesterday. Not good enough! The Vice President and cabinet members must invoke the 25th amendment NOW and remove Trump from office before he incites more violence and chaos.,
BernieSanders,1346960922615685121,2021-01-06 23:24:43,"The man directly responsible for the chaos of today is Donald Trump, who has made it clear that he will do anything to remain in power – including insurrection and inciting violence. Trump will go down in history as the worst and most dangerous president in history.",
BernieSanders,1346872034358341632,2021-01-06 17:31:31,"Thank you to everyone who made a call, knocked a door, or made a contribution to help elect @ReverendWarnock and @ossoff. We win when we organize. We win when we build a multiracial, multigenerational coalition. We win when we make clear we’re on the side of the working class.",
BernieSanders,1346855823998414856,2021-01-06 16:27:06,"With Democrats in control of the Senate, we must keep faith with the working families of this country. Promises made must be kept. That means not only the $2,000 direct payment, but an aggressive agenda that recognizes the economic desperation facing so many Americans.",
BernieSanders,1346490650594840577,2021-01-05 16:16:02,"A $15 minimum wage, fighting climate change and expanding health care are at stake in today’s Senate runoffs. 

Phonebank with Georgia @WorkingFamilies today to win in Georgia. https://t.co/Q3aMjoSkfE",
BernieSanders,1346433769138343937,2021-01-05 12:30:00,"Today is the day, Georgia. Your vote will decide which party controls the United States Senate and the direction of our country.

Polls close at 7:00 p.m. Find your polling place at https://t.co/8ttsSvUQYL. https://t.co/WFZpq9Qvjt",
BernieSanders,1346170419196342275,2021-01-04 19:03:33,Trump’s threat against the Secretary of State of Georgia is outrageous. It is the most consequential attack on American democracy in the history of our country. https://t.co/g6Krlb5Y23,
BernieSanders,1346125551539548162,2021-01-04 16:05:15,"I stand in solidarity with @AlphabetWorkers who are organizing to form a union at Google. What these workers are fighting for is not radical. They want fair wages and a workplace free from abuse, retaliation, intimidation and discrimination. And that is exactly what they deserve.",
BernieSanders,1345799163057991682,2021-01-03 18:28:18,"I don't often agree with Sen. Mitt Romney. But in describing the tactics of his GOP colleagues to undermine Joe Biden's victory, he is right when he says, ""I could never have imagined seeing these things in the greatest democracy in the world. Has ambition so eclipsed principle?”",
BernieSanders,1345458009502322694,2021-01-02 19:52:41,"It is a sad and tragic day for our country that 140 members of the House of Representatives, 13 senators and a defeated president are attempting to undermine American democracy and our Constitution. 

They will not succeed.",
BernieSanders,1344674221423779842,2020-12-31 15:58:11,"Republican leadership has endless amounts of money for bloated military budgets and tax breaks for billionaires.

But when working families need help, oh my God, we can’t afford it!

I am a little tired of that hypocrisy. https://t.co/L93jzgceAP",
BernieSanders,1344435229403045893,2020-12-31 00:08:31,"All of a sudden Mitch McConnell and Senate Republicans are worried that someone in America might get a $2,000 check ""who doesn't need it.""

Funny. They had no problem giving a $1.4 billion tax break to Charles Koch and his family with a net worth of $113 billion. What hypocrisy!",
BernieSanders,1344415229350965248,2020-12-30 22:49:03,"“I don't know how to live anymore. Sometimes it's so hard.""

This family says $2,000 checks would help them pay their back rent and survive. https://t.co/6hrJLReI9C",
BernieSanders,1344342195143405571,2020-12-30 17:58:50,"$2000 checks is a matter of life and death for millions of Americans.

Call your Senator at (202) 224-3121 and demand the Senate vote NOW on the bipartisan $2,000 direct payment legislation passed by the House of Representatives.",
BernieSanders,1344325795217600514,2020-12-30 16:53:40,"Trump supports the $2,000 payments, Biden supports the $2,000 and the American people support $2,000.

McConnell must allow a vote on the $2,000 payments now. https://t.co/JnWNVI0Wd4",
BernieSanders,1344100168984129546,2020-12-30 01:57:07,"$2000 checks for the working class passed the House of Representatives with bipartisan support. 

Mitch McConnell – Let’s have an up or down vote in the Senate NOW, and get this done. https://t.co/buRThqmNk2",
BernieSanders,1344037533894791175,2020-12-29 21:48:13,"This is about life and death for millions of people.

The Senate must approve the $2000 for every working class adult. https://t.co/tVtOqVXE0B",
BernieSanders,1343694040722776065,2020-12-28 23:03:18,"This week on the Senate floor Mitch McConnell wants to vote to override Trump's veto of the $740 billion defense funding bill and then head home for the New Year. 

I'm going to object until we get a vote on legislation to provide a $2,000 direct payment to the working class.",
BernieSanders,1343659451052675072,2020-12-28 20:45:51,"At a time when so many people are facing economic desperation, the $600 direct payment is a step forward – but it's not enough. We need to increase that direct payment to $2000. Biden wants it, Trump wants it, Pelosi wants it, Schumer wants it. Now, Congress must vote to do it.",
BernieSanders,1343346172119949312,2020-12-28 00:01:00,"Along with Vice President-elect @KamalaHarris and Sen. @EdMarkey, I've been fighting for months to get Congress to pass a $2,000 direct payment for the working class. The House must pass this legislation tomorrow and the Senate must quickly follow suit. Let's get this done – NOW!",
BernieSanders,1343238335641362434,2020-12-27 16:52:30,"Sign the bill, President Trump. https://t.co/Dk71W6awLk",
BernieSanders,1342940106349490176,2020-12-26 21:07:26,"In this dangerous moment – COVID, oligarchy, economic desperation, climate change, a dysfunctional health care system, systemic racism, etc. – we must continue fighting for a political revolution and transformative change. Nothing less than the future of the world is at stake.",
BernieSanders,1342176527560155138,2020-12-24 18:33:15,"Congress must pass $2,000 in direct payments and Trump must sign the COVID-relief bill. If not, tens of millions of Americans will lose their unemployment benefits, go hungry and face eviction. This would be a level of governmental cruelty not seen in our lifetimes.",
BernieSanders,1341571523770019840,2020-12-23 02:29:11,"That's great! I first introduced a bill to provide a $2,000 direct payment with @SenKamalaHarris &amp; @EdMarkey 7 months ago. Now, Mr. President, get Mitch McConnell and your Republican friends to stop opposing it and we can provide working class Americans with $2,000. Let's do it. https://t.co/fKvqBsqM0k",
BernieSanders,1341525056996962305,2020-12-22 23:24:32,"Good politics: Over the past decade, every Medicare for All co-sponsor up for re-election beat their Republican opponent – every single one.

Good policy: Medicare for All would save 68,000 lives and cost $650 billion LESS than our current dysfunctional healthcare system a year.",
BernieSanders,1341506887628562434,2020-12-22 22:12:20,"Joe Biden is absolutely right. During the worst economic crisis since the 1930s, working families desperately need more direct payments to pay the rent and put food on the table. The $2,400 in direct payments that will be sent to a family of 4 is a start, but much more is needed. https://t.co/vrzx5Gjuyi",
BernieSanders,1341469375329611782,2020-12-22 19:43:17,"Republicans &amp; some conservative Democrats thought that a $1,200 survival check for the working class was too costly. But they had no problem giving the bloated Pentagon $740 billion for weapons &amp; war.

Maybe, just maybe, it's time to fundamentally rethink our national priorities.",
BernieSanders,1341185717679116290,2020-12-22 00:56:07,"We fought very hard to make vaccines for COVID-19 free for every man, woman &amp; child in America. Now, we must make certain that no health insurance company, pharmacy or medical provider is able to charge the uninsured or under-insured any type of fee before they get the vaccine.",
BernieSanders,1341179196186497024,2020-12-22 00:30:12,"I wanted $1200 in direct payments. We got $600.

Will that help? Yes, it will.

Is it enough? No, it is not. https://t.co/FuFSpcWgbc",
BernieSanders,1341116885597904898,2020-12-21 20:22:36,"While Mitch McConnell and Senate Republicans refused to provide adequate relief for working families facing economic desperation, they had no problem giving a $5 billion, 100% tax deduction to CEOs for a 3-martini lunch. You got it. The GOP loves corporate socialism for the rich.",
BernieSanders,1340496108066402306,2020-12-20 03:15:52,"Maybe – just maybe – it’s time Congress listened to the American people and sent $1,200 survival checks to working class Americans who are in so much desperation right now. https://t.co/UvUSIbNX71",
BernieSanders,1340442410082562048,2020-12-19 23:42:29,"Never forget. The same ""centrists"" who tell us we cannot afford to give the working class and seniors a direct payment to pay the rent and feed their families during a pandemic, all voted to give the bloated Pentagon a record $740 billion without ""paying for it."" Unacceptable!",
BernieSanders,1340412804411645953,2020-12-19 21:44:50,We need $1200 direct payments for every working class adult and $500 for each of their kids NOW. https://t.co/FdU3zudvcX,
BernieSanders,1340374541550403585,2020-12-19 19:12:48,"Sen. Ron Johnson objected to my bill to provide $1,200 to working families and $500 for kids because he's ""worried"" about the deficit. Funny. He wasn't so worried about the deficit when he voted to give $1 trillion in tax breaks to the 1% and large corporations. What hypocrisy!",
BernieSanders,1339753759539400706,2020-12-18 02:06:02,"“Here in Georgia we know voter suppression when we see it... No matter our zip code, our age, our skin color, every voter should have a say in our democracy and access to the ballot box.” -Klaire Gumbs, New Georgia Project https://t.co/n9iveDwztp",
BernieSanders,1339751568770527238,2020-12-18 01:57:20,"“Voting for @ossoff and @ReverendWarnock means two specific issues will get the attention they so deserve: climate change and racial justice… Addressing these issues is the complete opposite of radical. It’s common sense.” -Chase Stell, President of Young Democrats of Atlanta https://t.co/lFh0lWhsmb",
BernieSanders,1339750487025995777,2020-12-18 01:53:02,"“Once the vaccinations are out, we’ll still be dealing with the pandemic. While Amazon and Uber are making billions in profit, essential workers and domestic workers are still out of jobs.” -YT Bell, Fmr. Clarkston, GA Councilwoman https://t.co/dPNW4TvtRb",
BernieSanders,1339748129059598336,2020-12-18 01:43:39,"“To the young people listening: it’s crucial that you understand the importance of your vote… You’re voting for all the people who come after us and all the people today who cannot.” -First time voter, Sydney Spessard https://t.co/wXT5c6D62I",
BernieSanders,1339745294913859586,2020-12-18 01:32:24,"“In Georgia, our votes matter so much right now because we have the opportunity to fight for the things we want to see with one election, the most important one.” -Val Barnhart, UFCW Local 1996 https://t.co/RozjzliO4D",
BernieSanders,1339743348823891970,2020-12-18 01:24:40,"“This is a turnout election, and we know the results will be just as razor-thin as they were in November… Let’s get to work and elect some senators who care about all of Georgia, not just themselves.“-@NikemaWilliams https://t.co/hgclNnnuCr",
BernieSanders,1339742215053176833,2020-12-18 01:20:09,To my friends in Georgia: The stakes of the runoff elections on January 5th could not be higher. You will decide which party controls the United States Senate. https://t.co/1RRdtGhbYi,
BernieSanders,1339735982317301760,2020-12-18 00:55:23,"Victory in the Georgia runoffs will not only remove Mitch McConnell as Majority Leader, but will go a long way in transforming this country. Join me for a virtual rally with @NikemaWilliams and more: https://t.co/HCER2hw4Va",
BernieSanders,1339401137582182401,2020-12-17 02:44:50,"I am happy to say as we enter the holiday season, when so many families are struggling, at least there will be direct payments for every working class adult and their children, and an extension of unemployment benefits.

It is not enough, but it is progress. https://t.co/schw1BopPk",
BernieSanders,1339277424748584960,2020-12-16 18:33:15,"It is good news that the latest COVID-relief proposal now includes direct payment to every working class adult and for each of their kids.

But at a time when we are facing the worst economic crisis since the Great Depression, Congress must do more. https://t.co/gwbhWynv0Z",
BernieSanders,1339232012352303104,2020-12-16 15:32:48,"Early voting in Georgia has begun, and there is a whole lot at stake: a $15 minimum wage, expanded health care, combating climate change and more. Join me tomorrow with @NikemaWilliams for a virtual town hall, “Justice On Our Minds.” https://t.co/QLBk1K5Tjv",
BernieSanders,1338970272129572864,2020-12-15 22:12:44,"I've gotten to know @ninaturner over the last five years. She deeply cares for working families and she has the heart to be an effective, unwavering fighter for them in Congress. I am proud to endorse her candidacy. https://t.co/G1CPaDB9v3",
BernieSanders,1338920553692844032,2020-12-15 18:55:10,The government is controlled by powerful and wealthy interests. We need to break them up to save our democracy and give people back their freedom. Join me live with @PplsAction and @econliberties. https://t.co/61zrQoq96R,
BernieSanders,1338684757174071302,2020-12-15 03:18:12,"Congress cannot go home for the Christmas holidays until we begin to address the economic desperation in this country, and that means providing a $1,200 direct payment to working class adults, $2,400 for couples, and a $500 payment to their children NOW. https://t.co/QesJa3Yvto",
BernieSanders,1338679456886644736,2020-12-15 02:57:08,"What do progressives have to gain out of the Georgia runoff election?

A $15 minimum wage. 
Equal pay for women.
Expanded union membership.
Expanded health care.
Removing McConnell has Majority Leader.

And much more. https://t.co/i4TF4UQXOQ",
BernieSanders,1338650849275305988,2020-12-15 01:03:28,"Georgia, YOU can remove Mitch McConnell as Majority Leader. Early voting started today, and Election Day is January 5th. Join me with @KillerMike to discuss the critical Senate runoffs in Georgia: https://t.co/7Q3vYsk0qN",
BernieSanders,1338548420559114241,2020-12-14 18:16:27,"As a result of the pandemic, tens of millions of Americans are facing economic desperation. They can't afford to pay their rent and face eviction, they can't afford to go to the doctor, they can't afford to feed their children and they are going deeper and deeper into debt.",
BernieSanders,1337499814301462532,2020-12-11 20:49:39,"While the pandemic is surging, Senate Republicans want to provide a 100% deduction for rich people to go out for three-martini lunches and 100% legal immunity for corporations. “Pathetic” is too mild a word. https://t.co/VChVXeQylR",
BernieSanders,1337422787095519236,2020-12-11 15:43:35,"Wages subsidized by the government during pandemic:

🇨🇦 – $2,000 a month 
🇯🇵 – Up to 100%
🇳🇴 – Up to 90%
🇩🇪 – Up to 87%
🇫🇷 – Up to 84%
🇬🇧 – Up to 80%
🇮🇹 – Up to 80%
🇺🇸 – 0.0%

That is an international embarrassment. The working class needs our help NOW!",
BernieSanders,1337376231369666562,2020-12-11 12:38:35,"Brandon Bernard should be alive today. We must end all federal executions and abolish the death penalty. In a world of incredible violence, the state should not be involved in premeditated murder. https://t.co/TeppKF667T",
BernieSanders,1337238040935280640,2020-12-11 03:29:28,It would be outrageous and unacceptable for members of Congress to go home when tens of millions of working families are facing economic desperation. We must act now. https://t.co/8StfUHuMdC,
BernieSanders,1337160528830083078,2020-12-10 22:21:27,"People all over the country are thinking: Does the government hear their pain? Does their government give a damn about them?

If we rally the American people, we can make sure Congress provides at least a $1200 payment for every working class adult. https://t.co/Ng0zzmYBGR",
BernieSanders,1337156424972054535,2020-12-10 22:05:09,I will be voting against the Defense Appropriations bill. We need to get our priorities right. At a time when we have enormous unmet needs in our country we should not be spending $740 billion on the military – more than the next 10 nations combined.,
BernieSanders,1337111019450208257,2020-12-10 19:04:44,"Corporate irresponsibility during this pandemic has led to the deaths of hundreds of workers.

Legal immunity for corporations that break the law cannot be included in any Covid-relief package. https://t.co/93v9TJDqCu",
BernieSanders,1337101244549181445,2020-12-10 18:25:53,"Endless money for wars? No problem. Endless money for tax breaks for the rich? No problem. Endless money for corporate welfare? No problem. But when it comes to providing a $1,200 direct payment to the working class during a pandemic, somehow we can't afford it. Not acceptable.",
BernieSanders,1337046431249608709,2020-12-10 14:48:04,"Congress must not leave for the Christmas holiday until we protect working people.

That means $1200 for every working class adult, $500 for their kids and a $600 per week supplement in unemployment benefits. https://t.co/RfaoLjrsoT",
BernieSanders,1336840360748781573,2020-12-10 01:09:13,"I applaud this effort to end Facebook’s monopoly. Their greed knows no bounds, and they’ve used their power to try and control too much of political and economic life all over the world. The only thing that will stop Facebook is to say “enough is enough” and break it up. https://t.co/lRaqvNwj3T",
BernieSanders,1336746926197387265,2020-12-09 18:57:57,"Millions are unemployed, facing eviction, have no health insurance, and going hungry. This is an EMERGENCY, and the U.S. government must respond. Any COVID agreement must include at least $1,200 in direct payments for adults, $500 for kids and supplemental unemployment benefits.",
BernieSanders,1336733869752668162,2020-12-09 18:06:04,"Here in Washington, when we go to war there’s endless amounts of money.

But when children are going hungry today, suddenly we don’t have enough money.

That’s wrong. Congress needs to make sure families get the help they need. https://t.co/JmBCvxl2PQ",
