Tweeter,Tweet ID,Tweet Time,Tweet Text,Topics
senatemajldr,1318960373639172101,2020-10-21 17:00:32,"NOW: The Senate is voting on another rescue package for American families.

Testing. Treatments. Vaccines. Unemployment aid. Another PPP. Historic money for schools. Find common ground &amp; get help out the door.

We'll see if Democrats use the filibuster to kill the bill.",
senatemajldr,1318958973144489989,2020-10-21 16:54:58,"Democrats have said we shouldn’t pass any more relief at all unless Speaker Pelosi gets her whole far-left wish list, including all kinds of non-COVID-related demands. 

Working families in Kentucky and around the country deserve better than this obstruction.",
senatemajldr,1318647847546474501,2020-10-20 20:18:40,"The Paycheck Protection Program has made a critical difference for millions of working families. Today, I’m having the Senate vote on a new second round for the hardest-hit small businesses.
 
Democrats say they support the PPP. Let’s see how they vote.",
senatemajldr,1318601864926081025,2020-10-20 17:15:57,"Democrats have delayed aid for months over non-COVID-related liberal demands. Last night, Leader Schumer even tried to adjourn the Senate for three weeks. Americans need help; Democrats just want to go home.
 
We are voting on more aid this week.",
senatemajldr,1318341206858977281,2020-10-20 00:00:11,"Speaker Pelosi’s all-or-nothing act has kept Americans waiting for months. We badly need Congress to agree where we can, get money out the door now, and keep arguing over the Speaker’s non-COVID-related wish list later.

We'll vote on hundreds of billions in more aid this week.",
senatemajldr,1318312942438408193,2020-10-19 22:07:53,"Last week, Judge Barrett proved she has the deep legal expertise, judicial temperament, and intellectual horsepower that Americans deserve to have on the Supreme Court. The Senate will turn to her nomination as soon as it comes out of committee later this week.",
senatemajldr,1317571617837490184,2020-10-17 21:02:07,I just announced the Senate will vote next week on hundreds of billions more dollars for relief programs that Democrats do not even oppose. Working families have already waited too long for Speaker Pelosi’s Marie Antoinette act to stop. Let's make law. https://t.co/iR7OYKuCKw,
senatemajldr,1317148869877268480,2020-10-16 17:02:16,"Judge Barrett exhibited every bit of the intellectual brilliance, legal expertise, and open-minded judicial temperament that we need on the Supreme Court. I will proudly vote to confirm her. The Senate will take up her nomination as soon as it comes out of Committee. https://t.co/KkOGo0JVKL",
senatemajldr,1316450548854468609,2020-10-14 18:47:23,It is bizarre to watch Vice President Biden and Democrats refuse to give a straight answer on their own party’s threats to pack the Supreme Court. But it is even more absurd for them to try to redefine “court-packing” to mean any judicial confirmation that disappoints Democrats. https://t.co/RpZbaXNO2m,
senatemajldr,1316051684892827650,2020-10-13 16:22:27,"We don’t agree with Speaker Pelosi that “nothing” is better than “something” for workers.

Senators will vote on more relief next week, including more PPP money to stop layoffs. We’ll be able to pass it before we turn to Judge Barrett's nomination unless Democrats block it again. https://t.co/paJFhx5HcI",
senatemajldr,1316048753510449152,2020-10-13 16:10:48,Judge Barrett is just as brilliant and impressive as advertised. She is clearly qualified. She’s committed to fairness and impartiality. And she clearly understands the job of a judge under the Constitution is to apply the law and not impose personal policy views.,
senatemajldr,1315315247675330560,2020-10-11 15:36:07,"The far left has been threatening our basic institutions of government since long before this Supreme Court vacancy. When today’s Democrats lose one election or one vote on the Senate floor, they start threatening to tear up the rulebook. https://t.co/CT3rnShGZD",
senatemajldr,1314728749330509827,2020-10-10 00:45:34,Judge Barrett is a stellar nominee. I think the president picked the single best person he could have picked anywhere in the country. This is a woman of extraordinary achievement. https://t.co/E1pyp1PPHU,
senatemajldr,1313858790924726272,2020-10-07 15:08:40,"ICYMI: I joined @marthamaccallum to discuss the Senate’s months of success with hybrid hearings, Judge Barrett’s outstanding qualifications, and Democrats’ refusal to get serious on COVID-19 relief talks. https://t.co/QrBro8587T",
senatemajldr,1313813018241896449,2020-10-07 12:06:47,"The ongoing attacks by Senate Democrats and the media on Judge Barrett’s faith are a disgrace. They demean the confirmation process, disrespect the Constitution, and insult millions of American believers. https://t.co/Qg5mFQzWFO",
senatemajldr,1313501399632748544,2020-10-06 15:28:32,President Trump made an outstanding choice in Judge Amy Coney Barrett. She is one of the finest legal minds of her generation. She’s won national admiration for her example of strong female leadership. She’s exactly the kind of person Americans deserve on their highest Court. https://t.co/eYEle2s1nw,
senatemajldr,1313275429894135808,2020-10-06 00:30:36,"Judge Barrett’s hearings will begin one week from today. Chairman Graham has all the tools to conduct a hybrid hearing, just like the 150 others the Senate has held this year.
 
We will not stop working for the American people because Democrats are afraid they may lose a vote.",
senatemajldr,1313248059766255621,2020-10-05 22:41:51,"Democrats say they’ll try everything to stall Judge Barrett. The latest excuse: Hybrid hearings with some virtual participation are suddenly bad. 

The Senate has held 150 of these hybrid hearings since May. Democrats have taken advantage of the tools. They’ve praised the format.",
senatemajldr,1312488017148346369,2020-10-03 20:21:42,"Just had another great call with @POTUS. He sounds well and says he’s feeling good. We talked about the people’s business — fighting the pandemic, confirming Judge Barrett, and strengthening the economy for American families. Let’s keep our President &amp; First Lady in our prayers.",
senatemajldr,1312441098757836801,2020-10-03 17:15:16,Senate floor proceedings will be postponed until October 19th. The @SenJudiciary confirmation hearings for Judge Barrett’s nomination to the Supreme Court will convene on October 12th as scheduled by Chairman Graham. My full statement: https://t.co/7ThKZPJBZG,
senatemajldr,1312076870645620737,2020-10-02 17:07:57,"ICYMI: I joined @HughHewitt this morning to discuss Judge Barrett’s outstanding qualifications, the decision by some on the left to attack her religious faith, and the Democrats’ ongoing threats against our governing institutions. https://t.co/Ze5EbW63qH",
senatemajldr,1312042678217998338,2020-10-02 14:52:05,"Just finished a great phone call with @POTUS. He’s in good spirits and we talked business — especially how impressed Senators are with the qualifications of Judge Barrett. Full steam ahead with the fair, thorough, timely process that the nominee, the Court, &amp; the country deserve.",
senatemajldr,1312006437376319489,2020-10-02 12:28:05,Happy to hear the White House physician’s report that @POTUS and @FLOTUS are feeling well following their positive tests for COVID-19. Let’s continue to pray today and every day for our President and our First Lady and for all those impacted by COVID-19.,
senatemajldr,1311789406139887616,2020-10-01 22:05:40,Tune in now to @BretBaier. I’ll be discussing Judge Barrett’s nomination to the Supreme Court and the Democrats’ ongoing obstruction of more bipartisan COVID-19 relief.,
senatemajldr,1311430098239750150,2020-09-30 22:17:55,"Everyone who knows Judge Barrett, across the political spectrum, praises her independence and impartiality.

A judge's job is to follow the facts and the law wherever they lead. Nothing more, nothing less.

It's revealing how much this basic concept seems to scare the far left.",
senatemajldr,1311392341585022977,2020-09-30 19:47:53,"Democrats want to pack the Supreme Court. Vice President Biden refused to rule it out last night. Now Senate Democrats are demanding promises and pre-commitments from Judge Barrett.
 
Judicial independence is vital to the rule of law. Why are Republicans alone in defending it?",
senatemajldr,1311350246547623938,2020-09-30 17:00:37,"Judge Barrett is an exemplary judge and a qualified nominee for the Supreme Court. Her legal peers across the political spectrum praise her independence, fair-mindedness, and impartiality. That is exactly what the American people deserve on their highest Court. https://t.co/Eawb6JuCeX",
senatemajldr,1311088540546207749,2020-09-29 23:40:41,"Multiple times, with multiple nominees, Senate Democrats have said or implied that certain personal religious beliefs make Americans unfit to serve. Judge Barrett in 2017 was only one example. Now the media’s joining in.

These tactics need to stop now. https://t.co/wisPUKXe2O",
senatemajldr,1311029507860684801,2020-09-29 19:46:07,I had the opportunity to meet with Judge Barrett earlier today. President Trump has nominated exactly the kind of outstanding person whom the American people deserve to have on their highest Court. https://t.co/0tTJqPwpeP,
senatemajldr,1309963158182932487,2020-09-26 21:08:49,"Judge Amy Coney Barrett is an exceptionally impressive jurist and an exceedingly well-qualified nominee to the Supreme Court.
 
A brilliant scholar. An exemplary judge. President Trump could not have made a better decision. https://t.co/FKadx6TJeU",
senatemajldr,1309327299653906432,2020-09-25 03:02:09,"Tune in: I’m about to join @ShannonBream @foxnewsnight for my first interview on the Supreme Court vacancy. The Senate will do what we did in 2016: Follow history, follow precedent, and do the job we were elected to do.",
senatemajldr,1309238722119032835,2020-09-24 21:10:10,"The far left called John Paul Stevens anti-woman. They said Anthony Kennedy would turn back the clock. David Souter was going to hurt “women, minorities, dissenters, &amp; other groups"" from the bench.
 
Anyone doubt the same old smears will be rearing their heads starting Saturday?",
senatemajldr,1309198438056316931,2020-09-24 18:30:06,"We don’t know which legal all-star the President will nominate on Saturday. So isn't it curious that everyone already knows exactly what smears and scare tactics the far left will trot out?
 
Their playbook has not changed for 45 years. The nominee is irrelevant to their attacks.",
senatemajldr,1309169766528057347,2020-09-24 16:36:10,"My full statement on Breonna Taylor, yesterday’s announcement, and the violence overnight in my hometown of Louisville: https://t.co/NN70M9oun8",
senatemajldr,1309126971058794499,2020-09-24 13:46:06,The winner of the November 3rd election will be inaugurated on January 20th. There will be an orderly transition just as there has been every four years since 1792.,
senatemajldr,1308889364726939654,2020-09-23 22:01:57,House Democrats’ first government funding bill intentionally left rural America behind. But @SenJoniErnst and other Republicans did not let the Democrats defund farm country. They secured the Commodity Credit Corporation funding that our farmers and ranchers depend on.,
senatemajldr,1308813662925316096,2020-09-23 17:01:08,"Yesterday, Sen. Schumer decided to vent his frustration by blocking a bipartisan Intelligence Committee meeting on counterintelligence with a leading expert on protecting our elections.

A partisan temper tantrum is one thing. Jeopardizing national security is a different story.",
senatemajldr,1308554682667859968,2020-09-22 23:52:02,"Rewarding Democrats’ tactics now would not stop their attacks on our institutions. Their threats predate this new vacancy by over a year.
 
Their recklessness only underscores the importance that we do our job and confirm a nominee who truly respects the Constitution.",
senatemajldr,1308513764925485057,2020-09-22 21:09:27,"Democrats are threatening to attack the foundations of the Senate and the Court if they do not get their way.
 
Here's the problem with this attempted blackmail: They have already been making these threats for many months. They've been campaigning on them for over a year.",
senatemajldr,1308475058847993857,2020-09-22 18:35:38,"Our Senate majority will do exactly the same thing in 2020 that we did in 2016: Follow Senate history, follow the clear precedent in each situation, and do exactly the job we were elected to do.
 
We are going to vote on President Trump's nominee to the Supreme Court this year.",
senatemajldr,1308157376734863360,2020-09-21 21:33:17,"Justice Ruth Bader Ginsburg was a generational legal giant and a trailblazing champion for American women. The Senate is grieving with the nation, praying for her family, and remembering her historic legacy.

My full Senate floor remarks: https://t.co/mfVTHURqIw",
senatemajldr,1308090170860855298,2020-09-21 17:06:14,House Democrats’ rough draft of a government funding bill shamefully leaves out key relief and support that American farmers need. This is no time to add insult to injury and defund help for farmers and rural America.,
senatemajldr,1307121192516628480,2020-09-19 00:55:52,"The Senate and the nation mourn the passing of Justice Ruth Bader Ginsburg and the conclusion of her extraordinary American life.

My full statement: https://t.co/NOwYLhDxIk",
senatemajldr,1307041290903789573,2020-09-18 19:38:22,"Today we honor National POW/MIA Recognition Day. More than 1300 patriotic Kentuckians still haven’t come home. They are not forgotten, and we are still searching.",
senatemajldr,1306961755017543681,2020-09-18 14:22:19,"ICYMI: I joined the @GuyBensonShow to discuss Speaker Pelosi holding up relief for Americans, Senate Democrats’ filibuster hypocrisy, and Democrats playing politics with election security. https://t.co/ioFcheGe0P",
senatemajldr,1306678061895647233,2020-09-17 19:35:01,"In 2019, under Republican policies:

- Fastest annual growth in household income on record
- Working-class &amp; middle-class families saw more of the gains
- Poverty lowest since 1950s
 
That's the leadership our nation will need as we rebuild after COVID. https://t.co/Byrmh3DgD8",
senatemajldr,1306314676402376705,2020-09-16 19:31:03,It’s been less than a year since my bill with Senator Kaine and @SenToddYoung raised the nationwide age for tobacco purchases to 21. We just learned there’s already been a major decline in e-cigarette use among young people. Huge bipartisan progress for the health of our kids. https://t.co/yosvf0SA56,
senatemajldr,1306247560852631559,2020-09-16 15:04:22,"Even Speaker Pelosi’s own House Democrats are sick of her blocking COVID-19 relief.

But she insists anything short of her multi-trillion wish list would make Democrats “a cheap date.” What a joke.

People are hurting. They need help. Not the Speaker's pointless political games.",
senatemajldr,1305909721082331136,2020-09-15 16:41:54,"Today is an historic day for Middle East peace. Landmark agreements formalized at the White House between Israel and the UAE and Bahrain. Thanks to the U.S. and the Trump administration, the winds of change are blowing across toward progress and peace.",
senatemajldr,1305660009624240132,2020-09-15 00:09:38,"The framers designed the Senate to be the country’s firewall against bad ideas and radical change. If Democrats are afraid their bad ideas could never meet the bar, it’s their proposals that need to be scrapped, not our country’s checks and balances.",
senatemajldr,1305638804032811015,2020-09-14 22:45:23,Great news: Experts have found a huge decline in teen vaping. This is just what we sought with my landmark legislation to increase the required age for all tobacco products to 21. Health officials say that law made a big difference. https://t.co/dqhz6fhQwg,
senatemajldr,1305615661008408578,2020-09-14 21:13:25,The Trump administration has helped secured two historic peace agreements between Israel and Arab nations in just the last few days. The winds of change are blowing and the Middle East is changing for the better. My full statement: https://t.co/FDbUKWrCpN,
senatemajldr,1305592763082248193,2020-09-14 19:42:26,"Senate Democrats are threatening to blow up the filibuster if they gain power and ram far-left policies through the Senate. But they just used the filibuster last week to block COVID relief. They used it this summer to kill @SenatorTimScott’s police reform bill.

Total hypocrisy.",
senatemajldr,1305560825466359808,2020-09-14 17:35:31,"All military families serve alongside their loved ones in uniform. The new Gold Star Families Memorial in Owensboro, KY commemorates the sacrifices these patriots made in the name of freedom. The nation can never repay our debt. But we can keep these families in our prayers. https://t.co/5bZkjgwqlB",
senatemajldr,1304810135882272768,2020-09-12 15:52:33,"Washington Democrats have now blocked two separate proposals to provide hundreds of billions of dollars for safe schools, jobs, and healthcare. They just do not want American families getting more help before the election. Pure cynicism.",
senatemajldr,1304400335717437441,2020-09-11 12:44:09,"Nineteen years ago, thousands of Americans were murdered by terrorists. National landmarks burned. Brave first responders put their lives on the line to save strangers.
 
May we never fail to honor them. And may we never tire of our pledge: Never Again. https://t.co/95QqWlm05m",
senatemajldr,1304187017731940352,2020-09-10 22:36:30,"ICYMI I joined @DanaPerino to discuss Speaker Pelosi &amp; Leader Schumer's continued efforts to block coronavirus relief funding for Americans. 
 
Every Senator who voted against relief needs to answer what in the proposal they actually disagreed with. Kids? Jobs? Healthcare? https://t.co/iuGc7fN01A",
senatemajldr,1304107662750158848,2020-09-10 17:21:10,"Every Senate Democrat just voted against hundreds of billions of dollars of COVID-19 relief. They blocked money for schools, testing, vaccines, unemployment insurance, and the Paycheck Protection Program.

Their goal is clear: No help for American families before the election.",
senatemajldr,1304102357668712450,2020-09-10 17:00:05,"Yesterday, reporters asked Sen. Schumer whether by refusing to compromise, he was making the perfect the enemy of the good. His response? “Republicans are the enemy of the good.”

Americans are not enemies. COVID-19 is our enemy. It's time for Washington Democrats to act like it.",
senatemajldr,1304077570258997248,2020-09-10 15:21:35,"The Senate is voting today on COVID-19 relief. Hundreds of billions more dollars to make schools safe for kids, to keep workers getting paid, and to invest in treatments and vaccines.

American families will see exactly which Senators want to send them more bipartisan help.",
senatemajldr,1303836621826121728,2020-09-09 23:24:09,"Speaker Pelosi &amp; Leader Schumer were attacking our new COVID proposal before they’d even read it.

They’re attacking it over provisions that literally have Democrat cosponsors.

They just don't want Americans getting another cent of bipartisan relief before the November election.",
senatemajldr,1303791960973606916,2020-09-09 20:26:41,"The coronavirus doesn't care about our election. But it's clear that's all Democrats care about. Look at the facts and ask each Democrat what in the proposal that we're voting on tomorrow they actually disagree with. 

More historic funding for schools? Jobs? Healthcare? https://t.co/p38BQjgvKM",
senatemajldr,1303749151222530051,2020-09-09 17:36:34,"This year’s Kentucky Derby showed our great traditions can adapt to overcome any challenge. But our sport must be protected. 

I’ve been proud to stand up for horseracing throughout my career. Today, I’m introducing new legislation to keep up that support. https://t.co/3sU5juOUCI",
senatemajldr,1303702948464205825,2020-09-09 14:32:59,"Republicans will not let Speaker Pelosi and Leader Schumer kill COVID relief behind closed doors without putting every Senator on the record.

Tomorrow, we'll vote to protect workers' paychecks, keep kids safe in school, and win the healthcare fight against the virus.",
senatemajldr,1303502554358329345,2020-09-09 01:16:41,"Republicans have built yet another effort to help Americans. Money for schools. Resources for parents. Testing. Vaccines. Another round of the job-saving PPP. And more.

The Senate will be voting this week. The nation will see who's serious about making law for American families.",
senatemajldr,1303479750623727618,2020-09-08 23:46:04,"Democrats have blocked any new COVID relief, saying anything short of their entire far-left wish list is “piecemeal” and “emaciated.”
 
The same Democrats rushed back to D.C. to pass piecemeal legislation for the Postal Service that did nothing at all for working families.",
senatemajldr,1303458251078594563,2020-09-08 22:20:38,"Republicans have spent months fighting for more COVID-19 relief. We proposed a major $1T bill. Speaker Pelosi &amp; Leader Schumer said no. We suggested smaller bipartisan deals. They said no again.
 
Today we put forward yet another proposal. They attacked it before even reading it.",
senatemajldr,1303320716071383040,2020-09-08 13:14:07,"Republicans and Democrats have big differences, but they should not stop us from agreeing where we can and making law to help Americans through this crisis. Working families cannot suffer more because Democrats think their pain helps them politically. The Senate is going to vote. https://t.co/HzbPxvRe9I",
senatemajldr,1303320637633687553,2020-09-08 13:13:49,"But Republicans are not done fighting for the American people. Today our majority is introducing a targeted proposal for kids, jobs, and healthcare to help with many of our most urgent challenges. No more obstruction behind closed doors. Every Senator will be going on the record. https://t.co/N7QdjXrQql",
senatemajldr,1303320570654855168,2020-09-08 13:13:33,Senate Republicans have been trying for months to deliver more COVID-19 relief to American families. Speaker Pelosi and Leader Schumer have blocked us at every turn. Every action has suggested they simply do not want families to get any more bipartisan help before the election. https://t.co/nEPUDXBzIt,
senatemajldr,1302194356754042880,2020-09-05 10:38:22,"As Kentuckians, Thoroughbred racing is practically in our bones. It’s who we are. We find our state’s unique history on the track &amp; in the stables. This year's 146th Kentucky Derby is going to look a little different, but the sun will keep shining bright on My Old Kentucky Home. https://t.co/ZjJPcGX5kj",
senatemajldr,1302007726671790080,2020-09-04 22:16:46,My Old Kentucky Home is our state song. I applaud Churchill Downs for keeping our tradition alive. “Cancel culture” cannot be allowed to destroy our history without so much as a real discussion. https://t.co/sZmRM8DO1l,
senatemajldr,1301522988299419650,2020-09-03 14:10:36,"I’m the only one of the four congressional leaders not from New York or California. It’s my job to look out for Middle America, especially my favorite state: Kentucky. https://t.co/8U79gAi6Vi",
senatemajldr,1300921017016123392,2020-09-01 22:18:35,The most important things each of us can do to help prevent the spread of COVID-19 are to wear a mask and practice social distancing. https://t.co/wTwvx8VvJy,
senatemajldr,1300791211050008576,2020-09-01 13:42:46,"I’m proud to be joined by prominent horseracing leaders in Kentucky as they take the courageous step to protect jobs and increase safety standards for horses, jockeys, trainers, breeders, and fans. I’m grateful to @RepAndyBarr for his strong leadership. https://t.co/wXIfr0HR7s",
senatemajldr,1298777000308596736,2020-08-27 00:19:01,"To my Democratic colleagues: The coronavirus doesn't have a stake in this election. Struggling families across America need our help, and Republicans stand ready to deliver. https://t.co/97iN3ul3cL",
senatemajldr,1298302986268155906,2020-08-25 16:55:27,"From Mammoth Cave in KY to the 400+ parks nationwide, I wish the @NatlParkService a happy birthday. Thanks to the Great American Outdoors Act, the NPS will stand the test of time for generations. I encourage everyone to get outside, socially distance, and explore these treasures. https://t.co/UihV7dxIc0",
senatemajldr,1298009672889311239,2020-08-24 21:29:56,"The coronavirus does not care about the election. Struggling Americans need our help now, and that can only happen if Washington Democrats stop playing games and actually help the American people. https://t.co/Xy2ixCAE7A",
senatemajldr,1297978166452133890,2020-08-24 19:24:44,"From homegrown hemp masks to distilleries making hand sanitizer, Kentuckians are leading by example. We’re going to keep working together to beat this virus. https://t.co/ll44Cdk9k5",
senatemajldr,1297338939657814016,2020-08-23 01:04:41,Republicans are committed to making sure the Postal Service remains well equipped to fulfill its important duties. But the Senate will not pass stand-alone legislation for the Postal Service while American families continue to go without the help they need.,
senatemajldr,1297318542493257729,2020-08-22 23:43:38,"If Washington Democrats would devote half the energy they spend worrying about their own re-elections to actually helping the American people, we could easily achieve the kind of targeted, bipartisan relief package that Republicans have wanted for weeks.",
