Tweeter,Tweet ID,Tweet Time,Tweet Text,Topics
KamalaHarris,1347314397790818304,2021-01-07 22:49:18,The challenge we’re facing in our country is about more than the actions of a few. It’s about how to transform a justice system that doesn’t work equally for all. https://t.co/w2ONQWUxjN,
KamalaHarris,1347290055040258054,2021-01-07 21:12:35,"For centuries, justice has been symbolized as a woman, blindfolded, a scale in her hands.

Her eyes are covered because justice shouldn’t depend on the color of your skin.

It shouldn’t depend on how much money you have.

Justice should be impartial. Our DOJ will ensure it is.",
KamalaHarris,1347279867574943745,2021-01-07 20:32:06,"We have witnessed two systems of justice: one that let extremists storm the U.S. Capitol yesterday, and another that released tear gas on peaceful protestors last summer. It’s simply unacceptable.",
KamalaHarris,1347253348861239297,2021-01-07 18:46:43,Tune in as @JoeBiden and I introduce our nominees for the Justice Department who will restore integrity and independence to the institution and ensure justice is applied equally across our country. https://t.co/Esv2jKwUHR,
KamalaHarris,1347208648397881344,2021-01-07 15:49:06,"Fidelity to the rule of law forms the bedrock of our democracy.

In the face of both the damage that has been done to our Justice Department and our country’s long-overdue reckoning on racial injustice, these are the right leaders to meet this moment. 
https://t.co/19zMzNROVr",
KamalaHarris,1346979694684631040,2021-01-07 00:39:19,"Democracy will prevail.
https://t.co/whY7hq0hPX",
KamalaHarris,1346963378732982274,2021-01-06 23:34:29,The words of a President matter. https://t.co/qkDSrit9LL,
KamalaHarris,1346942453241274370,2021-01-06 22:11:20,"I join President-elect @JoeBiden in calling for the assault on the Capitol and our nation’s public servants to end, and as he said, “allow the work of democracy to go forward.”",
KamalaHarris,1346898213836615685,2021-01-06 19:15:32,History made. Congratulations @ReverendWarnock and Jon @Ossoff on your hard-fought campaigns. Together we can give Americans the relief they deserve and restore America’s moral leadership around the world.,
KamalaHarris,1346602382004776960,2021-01-05 23:40:01,"Georgians, if you’re in line before the polls close at 7pm ET—stay in line! If you run into any trouble casting your ballot, call the voter protection hotline at (888) 730-5816.",
KamalaHarris,1346580235786006528,2021-01-05 22:12:01,"I know @ReverendWarnock and @Ossoff. We’ve talked about the promise of our country. How we must help Americans with $2,000 stimulus checks, ensure our children have clean air to breathe, and our small businesses can thrive. That’s who they are—and who they’ll be as U.S. Senators.",
KamalaHarris,1346528714436337666,2021-01-05 18:47:17,"The late great John Lewis shed his blood on the Edmund Pettus Bridge for our right to vote. The forces against him were powerful, but he knew the capacity of what our country could be was a fight worth having. Georgia, mask up today and march on to the ballot box in his honor.",
KamalaHarris,1346485848741715968,2021-01-05 15:56:57,"Georgians, today you can decide the fate of the Senate. If you run into any trouble making your voice heard at your polling place, be sure to call the voter protection hotline at (888) 730-5816.",
KamalaHarris,1346460199817764864,2021-01-05 14:15:02,"Georgia, polls are now open! Your vote is your voice, and your voice is your power. Now is the time to stand up, speak out, and vote for a better future. Go to https://t.co/FsQFse2eXb to find your polling location. 

📷: @kevloweryphoto https://t.co/zJbdJEUDsO",
KamalaHarris,1346265329794772993,2021-01-05 01:20:41,Picking up some takeout at @FlorianaDC with @DouglasEmhoff and we had to snap a selfie in front of the 17th Street community tree. https://t.co/ZZ4KTrYybk,
KamalaHarris,1346236602067136513,2021-01-04 23:26:32,Tomorrow Georgia will change the course of history for people all across our country. Find your polling place at https://t.co/FsQFse2eXb. https://t.co/Pzbhzc71vT,
KamalaHarris,1346199427380203522,2021-01-04 20:58:49,"We won Georgia in November, and we need everyone to vote one more time so @JoeBiden and I can do the necessary work to help our nation heal and recover. Tune in as Joe rallies voters in Georgia. https://t.co/ez17fwSaXA",
KamalaHarris,1346169917708640256,2021-01-04 19:01:33,A distribution plan for vaccines will be the utmost priority once @JoeBiden and I are sworn in. https://t.co/xdaSWzH90M,
KamalaHarris,1346109989769900034,2021-01-04 15:03:25,"Georgians: If you haven’t already turned in your absentee ballot, don’t put it in the mailbox—take it and return it to a drop box in your county now.",
KamalaHarris,1345914403154178049,2021-01-04 02:06:14,"When our children and grandchildren ask us where we were at this moment in time, we’re going to tell them what we did: that we didn’t stop calling and texting people, telling them what was at stake in the Georgia runoffs. https://t.co/hms7MBTG61",
KamalaHarris,1345875065355829249,2021-01-03 23:29:55,"Congratulations to fellow Californian, @SpeakerPelosi, for being reelected as Speaker of the House. I look forward to working together on behalf of the American people to move our nation forward and build a brighter future for generations to come.",
KamalaHarris,1345845696788746240,2021-01-03 21:33:13,"I’m in Savannah, Georgia to encourage folks to get out and vote on January 5 for @ReverendWarnock and @Ossoff. Tune in now for our voter mobilization drive-in. https://t.co/jgS742Ac4n",
KamalaHarris,1345839380179648514,2021-01-03 21:08:07,"See you on Instagram Live soon, @JanelleMonae! https://t.co/IMyKQnpj6N",
KamalaHarris,1345793151160770562,2021-01-03 18:04:25,Leaving for Georgia soon. Let’s get @ReverendWarnock and @Ossoff over the finish line. Two days to go.,
KamalaHarris,1345760998817492994,2021-01-03 15:56:39,"Truly a historic day with a record number of women—and women of color—being sworn in to Congress. Welcome!
https://t.co/2NC9MzZsVR",
KamalaHarris,1345499703308410881,2021-01-02 22:38:22,More than 3 million votes were already cast in the Georgia Senate runoffs. But the work isn’t over yet. Help us call one million voters before January 5. Sign up to phonebank today: https://t.co/JpoD1n7GFO,
KamalaHarris,1345382170962100226,2021-01-02 14:51:20,"Do your part to protect your neighbors this new year—wear a mask, continue to wash your hands, and practice social distancing. Better days are ahead but it will require all of us to step up.",
KamalaHarris,1345158326762532870,2021-01-02 00:01:51,"To end last year, @DouglasEmhoff and I called some of our frontline nurses like Liz to thank them for all they’ve done for our country. Every day, these heroes lift up those in need and we are better off because of them. https://t.co/vMg0KjbJkz",
KamalaHarris,1345052877358845952,2021-01-01 17:02:50,"New year, new President, new Vice President. https://t.co/m73uVfOKwn",
KamalaHarris,1344808806014996481,2021-01-01 00:52:59,"There’s no denying that 2020 has been a difficult year. From a global pandemic, to reckoning with racial injustice, to the devastating wildfires and hurricanes, there has been so much grief, struggle, and pain. But we’ve also seen America at its best.",
KamalaHarris,1344777726507573250,2020-12-31 22:49:29,"As we bring 2020 to a close, @DouglasEmhoff and I wanted to express our gratitude—and our nation’s gratitude—for all of our frontline workers, essential workers, farm workers, and more. Thank you for all the sacrifices you have made this year. It doesn’t go unnoticed.",
KamalaHarris,1344654484149047298,2020-12-31 14:39:46,"Congrats, @BeckyHammon. You may be the first, but I know you certainly won't be the last. 
https://t.co/dHXa9JFRWT",
KamalaHarris,1344471993584816128,2020-12-31 02:34:37,"As @JoeBiden said yesterday, once in office we will ensure that the COVID-19 vaccines are distributed equitably and free of charge—so it doesn’t matter the color of your skin or where you live. If you want a vaccine, you’ll be able to get one.",
KamalaHarris,1344436160429498369,2020-12-31 00:12:13,"Getting the COVID-19 vaccine was safe, easy, and pretty painless. 
https://t.co/odFh3lOrzh",
KamalaHarris,1344375704440467458,2020-12-30 20:11:59,"On the frontlines of this fight are nurses like Patricia who administered my vaccine yesterday. As the daughter of immigrants from Guyana, Patricia has been working tirelessly to protect and save lives.

To Patricia and all the nurses battling this pandemic—thank you. https://t.co/xFmCWI3jRs",
KamalaHarris,1344326604550529024,2020-12-30 16:56:53,Getting the COVID-19 vaccine will save your life. I have absolute confidence in our scientists and look forward to getting my second shot. https://t.co/a2NQmSL0Xb,
KamalaHarris,1344292212771860485,2020-12-30 14:40:13,"Georgia—@JoeBiden and I are headed your way soon ahead of the Senate runoffs. It is within our power to change the course of our country’s history but we need you to get out and vote.

What we did in November, we can do it again.",
KamalaHarris,1344096618795180032,2020-12-30 01:43:00,"We still have a way to go with cases, hospitalizations, and deaths hitting record highs recently—but there is hope.

Once sworn in, @JoeBiden and I will get to work in the first 100 days to ensure Americans mask up, distribute 100M shots, and get students safely back to school.",
KamalaHarris,1344041470462980099,2020-12-29 22:03:52,"I urge everyone, when it is your turn, get vaccinated. It's about saving your life, the life of your family members, and your community. https://t.co/VwZdWt2RZG",
KamalaHarris,1344021096220119040,2020-12-29 20:42:54,The Biden-Harris administration is committed to getting the pandemic under control as the toll of the pandemic continues to mount. Tune in now as @JoeBiden speaks to the ongoing crisis. https://t.co/ioSxAccVEj,
KamalaHarris,1343980778246516737,2020-12-29 18:02:42,"Today I got the COVID-19 vaccine. I am incredibly grateful to our frontline health care workers, scientists, and researchers who made this moment possible. 

When you’re able to take the vaccine, get it. This is about saving lives. https://t.co/T5G14LtFJs",
KamalaHarris,1343937383134334979,2020-12-29 15:10:15,"Only one week left until the Georgia Senate runoffs. That’s one week to phone bank, turn in your absentee ballot, and spread the word about @ReverendWarnock and Jon @Ossoff. Together we can flip the Senate and keep Georgia blue. https://t.co/ArdY9G4KoY",
KamalaHarris,1343731211118768141,2020-12-29 01:31:00,Day one @JoeBiden and I will act to get COVID-19 under control and save American lives. We’ll take action to protect Dreamers and send a bill to Congress with a roadmap to citizenship for 11M undocumented people. And we’ll rejoin the Paris Agreement. This is just the beginning.,
KamalaHarris,1343671929203470346,2020-12-28 21:35:26,"Georgia: there is just over a week until the Senate runoffs. This is our moment. Let’s give it everything we have—chip in what you can. 
https://t.co/mTfOyHH9AM",
KamalaHarris,1343650412579078144,2020-12-28 20:09:56,President-elect Biden and I will inherit a series of unprecedented challenges upon walking into the White House. Tune in now as @JoeBiden speaks to how we’ll address these challenges head-on. https://t.co/sXPRCYKJYw,
KamalaHarris,1343579159935770624,2020-12-28 15:26:48,"This tragedy is all too common for Black women across our nation whose concerns and pain are often downplаyed or ignored in our health care system.

We must do better. Our administration is committed to confronting these glaring racial health disparities.
https://t.co/StlfpkqEJC",
KamalaHarris,1343367564626456584,2020-12-28 01:26:00,"As the great John Lewis once said, “Democracy is not a state. It is an act.” Democracy is only as strong as our willingness to fight for it. Keep fighting for it each and every day.",
KamalaHarris,1343239134199087104,2020-12-27 16:55:40,"Educators, cafeteria workers, bus drivers, custodians, and the nurses who keep our schools running are being stretched to their limit by this pandemic. 

@JoeBiden and I are committed to ensuring they get the relief they deserve. https://t.co/XDvTD6vN97",
KamalaHarris,1342924088008978432,2020-12-26 20:03:47,"Like so many others, I stand on the shoulders of Shirley Chisholm and the Black women who came before me. Humbled to be included on @MsMagazine and @HigherHeights' #Chisholm2020 list alongside so many phenomenal women paving the way in their communities.
https://t.co/DPQB2cJwBU",
KamalaHarris,1342871544683327488,2020-12-26 16:35:00,"Our Kwanzaa celebrations are one of my favorite childhood memories. The whole family would gather around across multiple generations and we’d tell stories and light the candles. 

Whether you’re celebrating this year with those you live with or over Zoom, happy Kwanzaa! https://t.co/21bzGHZpYe",
KamalaHarris,1342583146110398471,2020-12-25 21:29:00,"To all of our frontline workers, servicemembers, and those who have an empty seat at the table or have fallen on hard times, you are on our minds not just today but every day.

Times may seem tough but know you are not alone.",
KamalaHarris,1342490547060154371,2020-12-25 15:21:03,"Our traditions may look a little different this year but the love we share remains the same. From our family to yours, have a safe and very merry Christmas. https://t.co/RSjkHwvcU2",
KamalaHarris,1342214601975472128,2020-12-24 21:04:32,"A reminder of the season—and hope for a brighter future. 
https://t.co/tocTa5ex1z",
KamalaHarris,1342125608738947072,2020-12-24 15:10:55,"Linda, my heart goes out to you for the loss of your mother. Know that @JoeBiden and I are going to do everything we can so no more families have to experience the pain you did. https://t.co/1oJVAPUJzo",
KamalaHarris,1341912421791838209,2020-12-24 01:03:47,"My first grade teacher, Mrs. Frances Wilson, attended my law school graduation. She instilled in me a deep belief in the importance and significance of public education that I carry with me to this day. https://t.co/5ZluYlFzVo",
KamalaHarris,1341870977685270528,2020-12-23 22:19:06,"This holiday season, @DouglasEmhoff and I wanted to give back to the community that has given us so much over these last four years. 

We stopped by @dcfireems today to drop off some @ToysForTots_USA, and thank them for their work to bring smiles to children this time of year. https://t.co/R0MMi4WhBw",
KamalaHarris,1341849163491897344,2020-12-23 20:52:25,"We must end the current status quo where school districts with the greatest needs get the fewest resources.

We must remove barriers to opportunity for poor and rural communities and communities of color.

Dr. Miguel Cardona will help us do that for our students—and our future.",
KamalaHarris,1341833254261972992,2020-12-23 19:49:12,"Georgians: this holiday weekend, be sure to virtually check in with your loved ones to see if they’ve voted in the Senate runoffs yet: https://t.co/FsQFse2eXb. https://t.co/iDe4Xi9keW",
KamalaHarris,1341786918397198336,2020-12-23 16:45:05,The Biden-Harris administration will prioritize investing in our schools so every child in America has the knowledge and skills to thrive. Tune in as we introduce our Secretary of Education nominee. https://t.co/Vwk2kcslyi,
KamalaHarris,1341751676143890436,2020-12-23 14:25:02,"As we approach Christmas and the start of Kwanzaa, please do your part to keep yourself and those around you safe: wear a mask, keep a safe social distance, and limit your travel. 

@JoeBiden and I know it’s hard, but we need to stay apart just a little bit longer.",
KamalaHarris,1341576259642425345,2020-12-23 02:48:00,"Why are so many powerful people trying to make it so difficult for us to vote? Because they know our power. They know when we vote, things change. They know when we vote, we win. https://t.co/wFYeln6X0M",
KamalaHarris,1341556199511257089,2020-12-23 01:28:17,"As we work to reopen our schools safely and responsibly, we must continue to build a public education system that lifts up all Americans, regardless of race, background, or zip code.

I trust Miguel Cardona with this important and critical work. https://t.co/3zJqkzBM6d",
KamalaHarris,1341529573113155584,2020-12-22 23:42:29,".@AlexPadilla4CA, I know you'll continue to be a champion for our great state in the Senate. Congratulations my dear friend. https://t.co/sN6Lz5TfCo",
KamalaHarris,1341515361993289728,2020-12-22 22:46:01,"Today marks 10 years since @BarackObama signed the repeal of Don’t Ask, Don’t Tell into law, bringing about an end to the discriminatory policy. To our LGBTQ+ military members, know that @JoeBiden and I will have your back and won’t stop fighting until we achieve equality.",
KamalaHarris,1341400466840817666,2020-12-22 15:09:27,"Black folks, Latinos, Asian Americans, and our Indigenous brothers, sisters, and friends are more likely to die from COVID-19.

I fully trust our public health experts—which is why I will be getting the vaccine next week. https://t.co/w409dSPKpu",
KamalaHarris,1341229898275442688,2020-12-22 03:51:41,Everything that was at stake in November is at stake in the Georgia Senate runoffs on January 5. https://t.co/t9xGdcFVAK,
KamalaHarris,1341206322042290176,2020-12-22 02:18:00,"The Georgia runoffs are about health care, about jobs, about justice. This will not be easy but it is within our power to change the course of our nation’s history by electing @ReverendWarnock and @Ossoff. https://t.co/TjYeiD5T6a",
KamalaHarris,1341191349673050112,2020-12-22 01:18:30,This is what leadership looks like. https://t.co/k0aAoTJZES,
KamalaHarris,1341169837570207746,2020-12-21 23:53:01,"This is about our lives, about the lives of our children, about our community, and the lifeblood of our nation. That’s what is at stake in the Georgia runoffs. 
https://t.co/qw56V0O2Om",
KamalaHarris,1341136817534464000,2020-12-21 21:41:49,"We will have our voices heard. We will not let people silence us. Georgia, what we did in November, we can do again. Go to https://t.co/FsQFse2eXb now to find your early voting location.",
KamalaHarris,1341103938041425920,2020-12-21 19:31:09,"To make meaningful change in the lives of Americans we need to take back the Senate. Please chip in to the Flip Georgia Fund if you’re able to. Every little bit counts. 
https://t.co/HAwhVAmuFS",
KamalaHarris,1341076599479750656,2020-12-21 17:42:31,"There are only 15 days left to get out the vote for the Georgia runoffs. That’s why I’m in Columbus, GA for a drive-in rally with @ReverendWarnock and Jon @Ossoff. Let’s flip the Senate blue. https://t.co/vSSYGMAB7x",
KamalaHarris,1341035177506729985,2020-12-21 14:57:56,"About to leave for Georgia. Muscogee County, see you soon!",
KamalaHarris,1340844648168865795,2020-12-21 02:20:50,"The climate crisis is an existential threat to all of us—particularly poor communities and communities of color who bear the greatest risks from polluted air, polluted water, and a failing infrastructure. 

@JoeBiden and our climate team are ready to tackle this on day one.",
KamalaHarris,1340788114185437188,2020-12-20 22:36:11,".@BidenInaugural will look a little different in January than in years past, but @JoeBiden and I can’t wait for you and your family to join our virtual celebrations.
https://t.co/Qmf0aS9GIL",
KamalaHarris,1340744383143038976,2020-12-20 19:42:25,"We’ve all heard about health care workers without the supplies they need to care for patients and save lives.

@JoeBiden and I are committed to ensuring our frontline workers have the personal protective equipment and support they deserve.",
KamalaHarris,1340711866440552450,2020-12-20 17:33:12,"The climate crisis is not a partisan issue. 

It’s not a hoax. https://t.co/QXyUdQWVei",
KamalaHarris,1340660552394285058,2020-12-20 14:09:18,One month until @JoeBiden is sworn in as president.,
KamalaHarris,1340479687072559104,2020-12-20 02:10:36,Our climate team is comprised of our country’s most seasoned public servants and climate experts. They know that addressing the climate crisis is about building safer communities for all Americans and will meet this urgent challenge. https://t.co/0WYpeEndKM,
KamalaHarris,1340447320945647617,2020-12-20 00:02:00,The climate team @JoeBiden and I introduced today is ready to confront the climate crisis head-on with our allies around the world. https://t.co/SKspQVHAff,
KamalaHarris,1340415777091047424,2020-12-19 21:56:39,"The Biden-Harris administration has one of the most ambitious climate plans in history:

✓Secure carbon-pollution free electricity by 2035. 
✓Achieve net-zero emissions no later than 2050.
✓Invest in a clean energy future, and create millions of good-paying jobs.",
KamalaHarris,1340379335681658880,2020-12-19 19:31:51,The climate crisis is a grave and growing threat to the planet we all share. The public servants and climate experts @JoeBiden and I are announcing today will confront this global challenge head-on. https://t.co/evA1QvYmzP,
KamalaHarris,1340362989619261448,2020-12-19 18:26:54,"There are less than 20 days until Election Day, Georgia. Make a plan and vote early at https://t.co/FsQFse2eXb.",
KamalaHarris,1340311930829987842,2020-12-19 15:04:00,"Nearly 3M students nationwide don’t have access to the internet at home—leaving many school districts this year scrambling to find ways to reach students. Pandemic or not, @JoeBiden and I are committed to expanding broadband access to every American.
https://t.co/8suAGrlFPB",
KamalaHarris,1340082938772402194,2020-12-18 23:54:04,Every single connection we make with voters between now and January 5th makes a difference. Take some time this weekend and help Georgia turn out the vote for the Senate runoffs. Sign up for a phone banking shift now: https://t.co/3qa2kWf6u8,
KamalaHarris,1340023280619630593,2020-12-18 19:57:01,Protect yourself and your loved ones—wear a mask.,
KamalaHarris,1339947590381674498,2020-12-18 14:56:15,"Georgia, can’t wait to be back next Monday to rally voters ahead of the Senate runoffs! Let’s flip the Senate.",
KamalaHarris,1339756801986875392,2020-12-18 02:18:07,"On the campaign, President-elect @JoeBiden and I proposed one of the most ambitious climate plans in history. This team will help make that plan a reality. 
https://t.co/MULIlpABb8",
KamalaHarris,1339717767847620608,2020-12-17 23:43:01,".@JoeBiden and I are focused on lifting up all Americans no matter where they live—whether it’s in big cities, rural areas, or anyplace in between. No one will be left behind.",
KamalaHarris,1339621751156830208,2020-12-17 17:21:29,Our democracy is stronger than any one man or woman. It is about the people—and the people spoke.,
KamalaHarris,1339581127401549825,2020-12-17 14:40:03,"There is no question that without immediate relief, these numbers will continue to rise. Americans can’t wait any longer for Congress to act. https://t.co/HWcKX7gjB7",
KamalaHarris,1339410994922201089,2020-12-17 03:24:00,".@JoeBiden and I are building a team that will help us meet the unprecedented challenges facing the American people—from containing this pandemic to rebuilding our economy—and deliver relief from coast to coast.

The American people deserve nothing less.",
KamalaHarris,1339393633141870593,2020-12-17 02:15:01,"People are suffering. The moratorium on evictions is about to end. 12 million Americans will lose unemployment benefits if Congress and President Trump fail to come together before the end of the month. 

It could not be more urgent that our leaders act.",
KamalaHarris,1339366480589320192,2020-12-17 00:27:07,"With @PeteButtigieg’s leadership, we are ready to write the next great chapter in our nation’s history, modernizing our infrastructure, creating jobs and opportunity, and helping usher in a clean energy future. https://t.co/BFiEJMfKfJ",
KamalaHarris,1339319019850043392,2020-12-16 21:18:32,Don’t let anyone put you in a box because of your gender. https://t.co/yCykclW8cN,
KamalaHarris,1339282519762604034,2020-12-16 18:53:30,"The Biden-Harris administration will transform our roads and bridges, transit systems, railways, ports, and airports—while powering them with clean energy.

And we'll expand our transportation system to serve communities of every size—urban and rural—all across our country.",
KamalaHarris,1339254201864491010,2020-12-16 17:00:58,To build back better we need to usher in a sustainable transportation system that helps us connect all Americans to jobs and opportunity. @PeteButtigieg will do that as Transportation Secretary. https://t.co/SqHBwIrOhV,
KamalaHarris,1339221737003749378,2020-12-16 14:51:58,"When I raise my right hand and take the oath of office, I'll be thinking about my mother and all the girls and boys watching who will know they can do anything. 
https://t.co/kqkeCxLjoW",
KamalaHarris,1339052380718051329,2020-12-16 03:39:00,"Despite a pandemic, despite all the obstacles, Americans’ voices were heard loud and clear. 
https://t.co/0AWx4UCqgr",
KamalaHarris,1339037441026613252,2020-12-16 02:39:38,It was great hearing from supporters on our thank you call last night and I can’t wait until we’re all together once again. https://t.co/WbFOHaj8oF,
KamalaHarris,1339009382147878912,2020-12-16 00:48:08,".@PeteButtigieg is a problem solver and trailblazing public servant. He’s committed to bringing people together and upgrading our transportation system in a way that’s safe, sustainable, and equitable. He gets it. And is ready to do the work. 
https://t.co/FuLiYz0dYU",
